{
  "schemaVersion": "guardrail-fabric.trustops-guardrail-action-decision.v0.1",
  "recordType": "TrustOpsGuardrailActionDecision",
  "decision_id": "trustops-guardrail-action-decision:block-001",
  "source_system": "SocioProphet/guardrail-fabric",
  "controlling_outcome": "block",
  "runtime_action": "block",
  "receipt_ids": ["trustops-receipt:block-001"],
  "gate_ids": ["gate://trustops/privacy-leakage"],
  "evidence_refs": ["evidence://trustops/privacy-leakage/trace-001"],
  "policy_refs": ["policy://trustops/runtime-action-v0.1"],
  "reason": "Mapped TrustOps outcome 'block' to runtime action 'block' using the monotonic provider-neutral translation table.",
  "issued_at": "2026-05-26T20:50:00Z",
  "authority_mutation": {
    "performed": false,
    "authority_plane": "SocioProphet/agent-registry",
    "downstream_intent": "requires-agent-registry-decision"
  },
  "agentplane_projection": {
    "outcome": "block",
    "runtime_action": "block",
    "authoritative_safety_owner": "SocioProphet/guardrail-fabric",
    "guardrail_action_ref": "trustops-guardrail-action-decision:block-001"
  },
  "labels": {
    "issue": "SocioProphet/guardrail-fabric#13",
    "fixture": "block-valid"
  }
}
